{
  "timestamp": "2026-06-12T12:00:00+00:00",
  "target_expression": "192.168.1.10",
  "resolved_targets": [
    {
      "expression": "192.168.1.10",
      "address": "192.168.1.10",
      "hostname": null,
      "family": "IPv4"
    }
  ],
  "ports": [
    22,
    80,
    443
  ],
  "technique": "connect",
  "authorized": true,
  "reason": "home lab",
  "rate_limit": 200.0,
  "concurrency": 100,
  "timeout": 0.75,
  "probe": true,
  "probe_insecure": false
}
